number,value,datetime_start,datetime_complete,duration,params_batch_size,params_channels,params_dropout,params_lr,params_weight_decay,system_attrs_tpe:relative_params:0,state
0,0.9618527909038944,2026-10-02 21:56:30.133801,2026-10-02 21:58:04.503768,0 days 00:01:34.369967,32,small,0.4330880728874676,0.0007106591851092234,0.00025378155082656634,,COMPLETE
1,0.9456141568214995,2026-10-02 21:58:05.105888,2026-10-02 21:59:14.082895,0 days 00:01:08.977007,64,small,0.15212112147976886,0.0015317709628184257,0.0001256104370001356,,COMPLETE
2,0.8347037103491197,2026-10-02 21:59:14.643690,2026-10-02 22:00:27.896695,0 days 00:01:13.253005,64,wide,0.3925879806965068,0.0008110848199986004,6.290644294586145e-06,,COMPLETE
3,0.1,2026-10-02 22:00:28.524505,2026-10-02 22:01:01.956636,0 days 00:00:33.432131,128,wide,0.4828160165372797,0.0009802925297345284,0.0017123375973163992,,PRUNED
4,0.661819898055361,2026-10-02 22:01:02.720516,2026-10-02 22:01:39.389245,0 days 00:00:36.668729,64,medium,0.45466020103939103,0.0006049716507542575,1.0842262717330169e-05,,PRUNED
5,0.1,2026-10-02 22:01:40.111255,2026-10-02 22:02:10.477097,0 days 00:00:30.365842,128,medium,0.46974947078209456,0.001379251735419649,0.003795853142670641,,PRUNED
6,0.780336512251073,2026-10-02 22:02:11.346237,2026-10-02 22:02:53.089942,0 days 00:00:41.743705,32,wide,0.13567451588694796,0.0011885603371219744,0.0020651425578959264,,PRUNED
7,0.8095748689392035,2026-10-02 22:02:54.009675,2026-10-02 22:03:32.074402,0 days 00:00:38.064727,64,wide,0.3861223846483287,0.0006821416720689545,6.235377135673162e-06,,PRUNED
8,0.9550636260048602,2026-10-02 22:03:32.952026,2026-10-02 22:04:46.780587,0 days 00:01:13.828561,32,small,0.05793452976256486,0.00030383889771994457,0.0028340904295147754,,COMPLETE
9,0.7492734310651736,2026-10-02 22:04:47.304315,2026-10-02 22:05:26.347491,0 days 00:00:39.043176,32,medium,0.44360637128816327,0.0012601416950106597,7.742116473996259e-05,,PRUNED
10,0.8227610448844023,2026-10-02 22:05:27.109191,2026-10-02 22:06:06.266472,0 days 00:00:39.157281,32,small,0.3405733823357181,0.0004339881648985682,2.9459940256348706e-05,"{""batch_size"": 32, ""channels"": ""small"", ""dropout"": 0.3405733823357181, ""lr"": 0.0004339881648985682, ""weight_decay"": 2.9459940256348706e-05}",PRUNED
11,0.9591698841698841,2026-10-02 22:06:07.028620,2026-10-02 22:07:29.005061,0 days 00:01:21.976441,32,small,0.39288064888583035,0.0004521156519827077,0.002690886927703587,"{""batch_size"": 32, ""channels"": ""small"", ""dropout"": 0.39288064888583035, ""lr"": 0.0004521156519827077, ""weight_decay"": 0.002690886927703587}",COMPLETE
12,0.9605310883215625,2026-10-02 22:07:29.745640,2026-10-02 22:08:49.675264,0 days 00:01:19.929624,32,small,0.44280663379073437,0.0005413140471622838,0.0008576963246772888,"{""batch_size"": 32, ""channels"": ""small"", ""dropout"": 0.44280663379073437, ""lr"": 0.0005413140471622838, ""weight_decay"": 0.0008576963246772888}",COMPLETE
13,0.9741616421978248,2026-10-02 22:08:50.655054,2026-10-02 22:10:05.400812,0 days 00:01:14.745758,32,medium,0.4639135860054778,0.000619591148067409,0.0003335186708319682,"{""batch_size"": 32, ""channels"": ""medium"", ""dropout"": 0.4639135860054778, ""lr"": 0.000619591148067409, ""weight_decay"": 0.0003335186708319682}",COMPLETE
14,0.9769191336987104,2026-10-02 22:10:05.955298,2026-10-02 22:11:21.372185,0 days 00:01:15.416887,32,medium,0.24925237170134168,0.00100149940052458,0.00020522153265271873,"{""batch_size"": 32, ""channels"": ""medium"", ""dropout"": 0.24925237170134168, ""lr"": 0.00100149940052458, ""weight_decay"": 0.00020522153265271873}",COMPLETE
